{"artifact":{"byteLength":306411,"path":"registry-descriptors.nq","sha256":"sha256:4957f64c0c27ef73261fd16879b798c8c5f33f0e91d4da3adeb9052c88c7e431"},"counts":{"atlasIndexPlacementCount":89,"conceptSchemeCount":29,"memberDispositionCounts":{"assignmentEvidenceOnly":4,"childReleaseOnly":6,"definitionOnly":1,"historicalEvidenceOnly":2,"memberRelease":70,"noPublisherRecord":3,"resourceFamily":1,"reviewWithheld":1},"quadCount":1168,"registrySourceCount":88,"resourceSchemeCount":88,"supportedRingStatementCount":83},"format":"refspec-atlas-registry-descriptors/3.0","graphIri":"urn:ref:atlas-v3:registry-descriptors","inputs":{"atlasIndexDigest":"sha256:4d71f33d1909f707623c29c637bfb3dca0954f278b77c0a7207d97f6818a2449","registryResourceProfilesDigest":"sha256:b0d20ca0a2237a70adafe27d9bec1077f96a071052c1ed26817e8aaa7175708f","resourceCatalogDigest":"sha256:0b96d7126180118a58c56bddfb6784016f567b69bbc12397aced91216925b508"},"proofDigest":"sha256:e296d88408f90449aa65dadef3355b9450baa938e5df88a9baa0beb60480c101","resourceIdSetDigest":"sha256:7001986799fe29641b3069138d6015356ee740cfe036104b069c8a035db7a151","schemaVersion":"3.0"}
